{
    "$schema": "http://json-schema.org/draft-07/schema#",
    "title": "UnderWorldSettings",
    "description": "Configuration for running the UnderworldGodot project.",
    "type": "object",
    "properties": {

        "pathuw1": {
            "description": "Folder location of the Underworld 1 game files.",
            "type": "string",
            "default": "C:\\Games\\UW1"
        },

        "pathuw2": {
            "description": "Folder location of the Underworld 2 game files.",
            "type": "string",
            "default": "C:\\Games\\UW2"
        },

        "gametoload": {
            "description": "Which of the two games to load.",
            "type": "string",
            "enum": [ "UW1", "UW2" ],
            "default": "UW1"
        },

        "level": {
            "description": "The game level to load. (0-8 in UW1, 0-71 in UW2)",
            "type": "integer",
            "minimum": 0,
            "default": 0
        },

        "lightlevel": {
            "description": "Set the lighting level of the dungeon. Value is ignored.",
            "type": "integer",
            "minimum": 0,
            "maximum": 7,
            "default": 6
        },

        "levarkfolder": {
            "description": "Which save context to load.",
            "type": "string",
            "default": "DATA",
            "enum": [ "DATA", "SAVE1", "SAVE2", "SAVE3", "SAVE4" ]
        },

        "shader": {
            "description": "Default shader used. Value is ignored. (was previously used to allow for selection of different shaders during experimentation of palette effects)",
            "type": "string",
            "default": "UWSHADER"
        },

        "FOV": {
            "description": "Default field of view.",
            "type": "number",
            "default": 75.0
        },

        "showcolliders": {
            "description": "Enables displaying of collision meshes and colliders in game",
            "type": "boolean",
            "default": false
        },

        "shaderbandsize": {
            "description": "Controls how many light shades are calculated in between the vanilla shades.dat colour palette values to smooth light shading. (no of interpolated colours between the vanilla colours)",
            "type": "integer",
            "default": 8
        },

        "synth": {
            "description": "Music synthesizer engine. 'cm32l' and 'mt32' use mt32emu (require ROM files). 'soundfont' uses a SoundFont (SF2) file. 'opl' uses AdLib/OPL FM synthesis.",
            "type": "string",
            "enum": ["cm32l", "mt32", "soundfont", "opl"],
            "default": "soundfont"
        },

        "synthpath": {
            "description": "Path to ROM directory (for cm32l/mt32) or .sf2 file (for soundfont). Empty = use defaults.",
            "type": "string",
            "default": ""
        },

        "rompath": {
            "description": "DEPRECATED: use 'synthpath'. Legacy path to ROM directory — still read if synthpath is empty.",
            "type": "string",
            "default": ""
        }

    }
}